"system_id","system_name","description","business_unit","primary_purpose","data_inputs","outputs","deployment_status","system_owner","vendor_or_internal","go_live_date","last_review_date","review_cycle","affected_persons","geographic_scope","eu_ai_act_risk_tier","nist_rmf_maturity_level","notes"
"FMoH-AI-001","NCDC Disease Surveillance Platform","ML model predicting disease outbreak probability by Local Government Area using historical case and environmental data","Nigeria Centre for Disease Control (NCDC)","Public health outbreak prediction and early warning","Patient case reports; hospital admission data; climate data; population density data; LGA-level reporting","Risk probability score (Low/Medium/High/Critical) per LGA; alert notifications to NCDC epidemiologists","Production","Director General, NCDC","External - Africa CDC / WHO AFRO technical support","2022-01-01","2025-01-01","6 months","General population - all 36 states and FCT","Nigeria (national)","High-Risk","2","System used in critical public health infrastructure. Outputs inform outbreak alerts and emergency resource deployment. Data quality gaps in rural LGA reporting identified. Model explainability limited. Quarterly review recommended but not consistently implemented."
"FMoH-AI-002","AI Radiology Assistant (LUTH)","Computer vision model detecting anomalies in chest X-rays and CT scans; flags suspected TB, pneumonia, and cancer cases for radiologist review","Radiology Department - Lagos University Teaching Hospital (LUTH)","Diagnostic imaging support","Anonymised patient chest X-rays and CT scan images","Anomaly probability score per image; recommended review flag (Urgent/Routine/Clear)","Production (Pilot)","Chief Medical Director, LUTH","Vendor - Inference Analytics Ltd (Lagos)","2023-06-01","2024-06-01","12 months","Hospital patients requiring chest imaging","Lagos State - LUTH only","High-Risk","1","EU AI Act Annex III - AI used in medical device/diagnostic context. No formal conformity assessment conducted. Training data sourced primarily from non-Nigerian patient cohorts. No audit trail for AI recommendations. Mandatory radiologist review in place but not formally documented."
"FMoH-AI-003","MamaAlert Maternal Risk Scoring Tool","Predictive model stratifying maternal mortality risk at antenatal registration and recommending specialist referral for high-risk pregnancies","National Primary Health Care Development Agency (NPHCDA)","Maternal health risk stratification and referral","Age; parity; blood pressure; haemoglobin levels; gestation week; LGA location; facility type","Risk category (Low/Medium/High); referral recommendation to community health worker","Production","Executive Director, NPHCDA","External - DabaDoc / USAID-funded development","2021-03-01","2024-03-01","24 months","Pregnant women at antenatal registration - 12 states active","Nigeria - 12 states","High-Risk","1","EU AI Act Annex III - AI system in healthcare affecting vulnerable population. Model trained on urban facility data only; rural performance not validated. CHEWs lack training to interpret AI outputs. No feedback mechanism to retrain model on updated Nigerian data. 24-month review cycle inadequate."
"FMoH-AI-004","DHIS2 Analytics and Forecasting Module","Health data aggregation and ML forecasting platform generating trend analysis and resource planning recommendations","National Health Management Information System (NHMIS) - FMoH","National health data analytics and resource planning support","Facility-level health service data; drug supply chain records; staffing data; disease burden statistics","Trend reports; demand forecasts; resource allocation recommendations (non-binding)","Production","Director, NHMIS Division, FMoH","External - University of Oslo (DHIS2); FMoH customisation team","2019-01-01","2025-01-01","12 months","Internal health planners and Ministry of Health officials","Nigeria (national)","Limited Risk","3","Human decision-maker retains full control - AI output is advisory only. Data completeness gaps from low-reporting facilities identified. ML forecasting module added 2023 without formal governance review. Transparency of forecast methodology should be documented."
"FMoH-AI-005","HealthLine Nigeria AI Triage Chatbot","Conversational AI system providing autonomous symptom assessment and triage guidance to patients via SMS and WhatsApp","FMoH eHealth Division","Patient-facing autonomous triage and health guidance","Patient-reported symptoms (text input); self-reported age; LGA location","Triage recommendation (Self-care/Primary Care/Emergency); facility referral suggestion","Production (FCT Pilot)","UNASSIGNED - governance gap identified","Vendor - Helium Health (Lagos)","2024-03-01","N/A","N/A","General public - FCT residents (pilot)","FCT Abuja (pilot)","High-Risk","0","CRITICAL GOVERNANCE GAP. Highest-risk system in inventory. Autonomous AI with no mandatory human review at point of decision. No accountable owner assigned. No adverse event reporting mechanism. Incorrect triage could delay emergency care. Immediate governance review recommended."
"FMoH-AI-006","NCDC Contact Tracing ML Model","Machine learning model identifying likely contacts and transmission chains during disease outbreaks using call data records","Nigeria Centre for Disease Control (NCDC) - Surveillance Division","Outbreak contact tracing prioritisation","Anonymised call data records (CDR); case interview data; geographic location data","Ranked list of priority contacts for field follow-up; transmission chain visualisation","Inactive (activated during outbreaks)","Director of Surveillance, NCDC","External - Africa CDC emergency support tool","2020-04-01","2023-01-01","Activated on outbreak basis","Individuals identified as potential disease contacts","Nigeria (activated by outbreak geography)","High-Risk","1","Activated during COVID-19 response. Use of call data records raises privacy concerns - data minimisation and consent protocols not publicly documented. Governance framework should be established prior to next activation. Data retention policy for CDR data not confirmed."
